{
  "schema_version": "1.0",
  "packet_id": "ep-trap-115-exit137",
  "experiment_id": "public-scrub-ep-trap-115-exit137",
  "target": {
    "target_class": "SERVING_STACK",
    "repository_or_project": "multi-host-rdma-or-linux-serving",
    "exact_revision": "aaaaaaaaaaaaaaaaaaaaaaaaaaaaaaaaaaaaaaaa",
    "identity_verification_status": "VERIFIED",
    "sanitized_target_alias": "qual-host-set-A"
  },
  "hypothesis": {
    "claim_under_test": "Exit status 137 proves SIGKILL-class termination, not OOM-killer identity.",
    "expected_confirming_observation": "see trap body",
    "expected_disproof_observation": "see trap body"
  },
  "environment": {
    "runtime_or_build_revision": "bbbbbbbbbbbbbbbbbbbbbbbbbbbbbbbbbbbbbbbb",
    "model_identity": "n/a-or-scrubbed",
    "engine_identity": "example-engine/0.1.0",
    "tool_versions": {
      "python": "3.12.3",
      "minefield": "local"
    },
    "configuration_identity": "cfg-hash-dddddddddddddddddddddddddddddddddddddddddddddddddddddddddddddddd",
    "isolation_workspace_identity": "public-scrub-pack"
  },
  "execution": {
    "started_at": "2026-08-07T12:00:00Z",
    "ended_at": "2026-08-07T12:00:05Z",
    "request_or_command_id": "cmd-render-history-1",
    "exit_code": 2,
    "http_status": null,
    "authentication_interpretation": "NOT_APPLICABLE",
    "completion_stop_status": "COMPLETED",
    "failure_cause": "NONE",
    "observed_count": 2,
    "summary_only": false
  },
  "artifacts": [
    {
      "ref": "sanitized-receipt-pointer",
      "sha256": "0000000000000000000000000000000000000000000000000000000000000000",
      "type": "manifest",
      "redacted": true,
      "original_or_derived": "derived",
      "bytes_available_locally": false
    }
  ],
  "controls": {
    "positive_control": "auto-or-documented-pass path",
    "negative_control": "forced-misconfig or mis-attribution path",
    "control_independence_status": "INDEPENDENT",
    "shares_same_harness": false
  },
  "review": {
    "proposer": "human:blackwellboy",
    "reproducer": "human:blackwellboy",
    "falsifier": "human:campaign-review",
    "adjudicator": "human:blackwellboy",
    "independence_status": "INDEPENDENT_REVIEW_WAIVED_WITH_REASON",
    "waiver_reason": "solo maintainer publication with dual-campaign receipts for GID; general Linux semantics for 137"
  },
  "claim": {
    "evidence_status": "contributor-measured, conditions as reported",
    "claim_boundary": "Does not claim 137 can never be OOM; requires kernel/cgroup evidence for killer attribution.",
    "disposition": "CORROBORATE_EXISTING",
    "unresolved_conditions": [],
    "capability_claim_kind": "NONE"
  },
  "sanitization": {
    "safe_public": true,
    "contains_private_identifiers": false,
    "contains_secrets": false,
    "redaction_performed": true,
    "allowed_for_public_intake": true
  }
}
